,Artist,Joined,Subscribers,Total Views,Date,Title,Category,Views,Likes,Dislikes,URL
0,SeedTime Money,2008-09-18,37948,2099227,2018-12-06,How to buy stock as a gift,Howto & Style,557,78,1,https://www.youtube.com/watch?v=9p5PItR-Efc
1,SeedTime Money,2008-09-18,37948,2099227,2018-12-03,How a Financial Advisor invests his own money,Howto & Style,3332,110,3,https://www.youtube.com/watch?v=9iMlG6FeuKw
2,SeedTime Money,2008-09-18,37948,2099227,2018-11-26,12 Best Side Hustle Ideas for 2019 [That Pay Well],Howto & Style,18895,965,18,https://www.youtube.com/watch?v=iJ-lR2v9n9k
3,SeedTime Money,2008-09-18,37948,2099227,2018-11-20,Ebates Review 2018 (automatic cashback for shopping),Howto & Style,1165,47,2,https://www.youtube.com/watch?v=ron3A9HjJ8k
4,SeedTime Money,2008-09-18,37948,2099227,2018-11-20,Obeying God. It's getting worse...,Howto & Style,2944,229,10,https://www.youtube.com/watch?v=PdaaHCjMbqo
5,SeedTime Money,2008-09-18,37948,2099227,2018-11-15,Lowering your bills with the Trim App,Howto & Style,4089,68,6,https://www.youtube.com/watch?v=rO0vpmelxn0
6,SeedTime Money,2008-09-18,37948,2099227,2018-11-12,Before buying Bitcoin/Crypto (Ask these 4 questions),Howto & Style,752,35,4,https://www.youtube.com/watch?v=Vx0F9SfjEKo
7,SeedTime Money,2008-09-18,37948,2099227,2018-11-05,8 Amazon Savings Hacks,Howto & Style,3667,168,8,https://www.youtube.com/watch?v=XrAqa4Mch-w
8,SeedTime Money,2008-09-18,37948,2099227,2018-10-31,The 5 essential financial tools that I use,Howto & Style,7696,120,15,https://www.youtube.com/watch?v=qm9EOD-OM9U
9,SeedTime Money,2008-09-18,37948,2099227,2018-10-27,Our New Morning Routine with Jesus,Howto & Style,2050,130,5,https://www.youtube.com/watch?v=9t33IzPxLr8
10,SeedTime Money,2008-09-18,37948,2099227,2018-10-23,How to be more generous (5 tips),Howto & Style,936,52,1,https://www.youtube.com/watch?v=Gc5ZD2w-_nk
11,SeedTime Money,2008-09-18,37948,2099227,2018-10-16,11 things to stop paying for!,Howto & Style,129875,4629,387,https://www.youtube.com/watch?v=35-yPE8rbJg
12,SeedTime Money,2008-09-18,37948,2099227,2018-10-09,Is Wealthy Affiliate a Scam or Legit?  (2018 review),Howto & Style,939,22,2,https://www.youtube.com/watch?v=Ghep2LZa-Os
13,SeedTime Money,2008-09-18,37948,2099227,2018-10-09,37 Bible Verses about money and finances,Howto & Style,2830,128,4,https://www.youtube.com/watch?v=balyd_Mqf2o
14,SeedTime Money,2008-09-18,37948,2099227,2018-09-27,How to track Net Worth [FREE tracking tool],Howto & Style,6635,144,12,https://www.youtube.com/watch?v=frYbUtZ3ino
15,SeedTime Money,2008-09-18,37948,2099227,2018-09-27,7 WEIRD things Christians should do with money,Howto & Style,33446,1540,51,https://www.youtube.com/watch?v=xsLOxxQslFw
16,SeedTime Money,2008-09-18,37948,2099227,2018-09-18,My 3-Step Process to save up to 50% on my purchases [Workshop],Howto & Style,3452,119,6,https://www.youtube.com/watch?v=J2nNA0GeNU4
17,SeedTime Money,2008-09-18,37948,2099227,2018-09-11,Should you ever pray for money? 🙏 💵,Howto & Style,2126,175,3,https://www.youtube.com/watch?v=bWSsyP94Hbw
18,SeedTime Money,2008-09-18,37948,2099227,2018-09-04,Fundrise vs. Rental Property (my actual earnings with each),Howto & Style,6144,366,24,https://www.youtube.com/watch?v=8oF7ioCzZEc
19,SeedTime Money,2008-09-18,37948,2099227,2018-08-30,How I save money on organic meat,Howto & Style,6433,430,38,https://www.youtube.com/watch?v=2g-LSh4JSbI
20,SeedTime Money,2008-09-18,37948,2099227,2018-08-27,10 things American Christians should do with their money,Howto & Style,3435,167,11,https://www.youtube.com/watch?v=7I5a7rbz9I4
21,SeedTime Money,2008-09-18,37948,2099227,2018-08-20,How we paid off our debt (case study),Howto & Style,2011,74,8,https://www.youtube.com/watch?v=zRqHO2mTCjk
22,SeedTime Money,2008-09-18,37948,2099227,2018-08-14,Rich Dad Poor Dad Lesson,Howto & Style,3198,121,0,https://www.youtube.com/watch?v=49Xqgju2xPk
23,SeedTime Money,2008-09-18,37948,2099227,2018-08-09,How to invest for beginners (with little money),Howto & Style,237436,6188,498,https://www.youtube.com/watch?v=EVGJvvbdbx8
24,SeedTime Money,2008-09-18,37948,2099227,2018-08-07,Save for retirement or pay off debt?,Howto & Style,6925,72,10,https://www.youtube.com/watch?v=EeiO8AYo4Uo
25,SeedTime Money,2008-09-18,37948,2099227,2018-07-31,How to find unclaimed money (for FREE),Howto & Style,9652,246,16,https://www.youtube.com/watch?v=u4oOjtj-sgg
26,SeedTime Money,2008-09-18,37948,2099227,2018-07-31,How to pay off debt on a low income,Howto & Style,21052,826,29,https://www.youtube.com/watch?v=zyHoqesH544
27,SeedTime Money,2008-09-18,37948,2099227,2018-07-24,5 Biblical Financial Principles Every Christian Should Know!,Howto & Style,5757,392,7,https://www.youtube.com/watch?v=AZQrrBRxMbQ
28,SeedTime Money,2008-09-18,37948,2099227,2018-07-24,Earn $30/hr testing websites [UserTesting Review],Howto & Style,92971,2720,116,https://www.youtube.com/watch?v=ZtuR08XAZi0
29,SeedTime Money,2008-09-18,37948,2099227,2018-07-16,Amazon wants to give you money (for your old stuff),Howto & Style,3522,172,7,https://www.youtube.com/watch?v=U6Ose9AmUk8
30,SeedTime Money,2008-09-18,37948,2099227,2018-07-10,SeedTime: Why Subscribe?,Howto & Style,3328,75,11,https://www.youtube.com/watch?v=tjH0YTDGTwI
31,SeedTime Money,2008-09-18,37948,2099227,2018-06-29,Make money decluttering your home (I made $2k),Film & Animation,6345,118,10,https://www.youtube.com/watch?v=Or1kKO6_KwA
32,SeedTime Money,2008-09-18,37948,2099227,2018-06-26,How to make money selling books online,Howto & Style,3154,239,2,https://www.youtube.com/watch?v=FafS-c4YaRY
33,SeedTime Money,2008-09-18,37948,2099227,2018-06-21,Money Problems in Marriage? (5 tips to help),Howto & Style,1041,41,0,https://www.youtube.com/watch?v=YtMrj-98RKU
34,SeedTime Money,2008-09-18,37948,2099227,2018-06-19,How to make a blog on Wordpress step by step for beginners (2018),Howto & Style,16310,402,22,https://www.youtube.com/watch?v=nulaAJah5is
35,SeedTime Money,2008-09-18,37948,2099227,2018-06-18,Will it sell on Ebay?  What to sell from around your house,Howto & Style,570,13,0,https://www.youtube.com/watch?v=PWgRC4YWuQ8
36,SeedTime Money,2008-09-18,37948,2099227,2018-06-18,How to sell on eBay 2018 [a step-by-step guide],Howto & Style,58055,1570,38,https://www.youtube.com/watch?v=iWw6UbQn_oU
37,SeedTime Money,2008-09-18,37948,2099227,2018-06-18,How to tell how much something will sell for on ebay,Howto & Style,406,23,0,https://www.youtube.com/watch?v=_9pHkW-nBtI
38,SeedTime Money,2008-09-18,37948,2099227,2018-06-13,Encouraging Bible Verses [on Finances],Howto & Style,7431,813,16,https://www.youtube.com/watch?v=LpVCo6nSGU8
39,SeedTime Money,2008-09-18,37948,2099227,2018-06-08,Getting out of debt: [9 benefits we found],Howto & Style,1715,105,1,https://www.youtube.com/watch?v=vJMk3FIxJ3I
40,SeedTime Money,2008-09-18,37948,2099227,2018-06-01,10 Free Budget Templates (Download Now),Howto & Style,2444,51,2,https://www.youtube.com/watch?v=gvRPFlES_xc
41,SeedTime Money,2008-09-18,37948,2099227,2018-05-25,7 ways to make passive income online 2018,Howto & Style,51502,1746,65,https://www.youtube.com/watch?v=6X2TG87eugM
42,SeedTime Money,2008-09-18,37948,2099227,2018-05-10,How to save money fast (5 easy ways),Howto & Style,28860,1058,50,https://www.youtube.com/watch?v=zjhWR_xpyng
43,SeedTime Money,2008-09-18,37948,2099227,2018-04-16,MediShare Review 2018: The good and the bad,Education,15215,158,16,https://www.youtube.com/watch?v=eQpx7hM_758
44,SeedTime Money,2008-09-18,37948,2099227,2018-04-04,How I got 0% on all my credit cards and car loans,Howto & Style,6224,124,15,https://www.youtube.com/watch?v=zXzcHu_u6g0
45,SeedTime Money,2008-09-18,37948,2099227,2018-03-27,How can I build wealth while in debt? [with the Seesaw Principle],Howto & Style,8941,212,11,https://www.youtube.com/watch?v=VKTnOH_LFtM
46,SeedTime Money,2008-09-18,37948,2099227,2018-02-20,Turo Car Rental Review (Airbnb for Cars),People & Blogs,1390,15,0,https://www.youtube.com/watch?v=alEPfTU8Vgw
47,SeedTime Money,2008-09-18,37948,2099227,2018-02-08,I have a confession to make...,People & Blogs,6625,207,6,https://www.youtube.com/watch?v=illjBKFrFdk
48,SeedTime Money,2008-09-18,37948,2099227,2016-12-27,Blogging tools I use!,Howto & Style,610,13,0,https://www.youtube.com/watch?v=ENP6NemSESs
49,SeedTime Money,2008-09-18,37948,2099227,2016-02-22,Minimalism for Beginners with Joshua Becker [AUDIO],Howto & Style,22766,211,11,https://www.youtube.com/watch?v=ABz4Licnol0
50,SeedTime Money,2008-09-18,37948,2099227,2015-03-31,How to find your calling in life with Jeff Goins,Howto & Style,4249,65,2,https://www.youtube.com/watch?v=tRXWx-3uBkU
51,SeedTime Money,2008-09-18,37948,2099227,2015-01-06,Easy ways to save on groceries [without coupons],Entertainment,23088,221,16,https://www.youtube.com/watch?v=bGxw8p2vhtk
52,SeedTime Money,2008-09-18,37948,2099227,2015-01-01,How to finally get out of that job you hate and find work you love,Entertainment,4291,46,3,https://www.youtube.com/watch?v=1EdCTTZJYPI
53,SeedTime Money,2008-09-18,37948,2099227,2014-11-24,Investing in Real Estate for Beginners (BiggerPockets' Brandon Turner),Entertainment,42652,329,35,https://www.youtube.com/watch?v=63kHfLZLNy0
54,SeedTime Money,2008-09-18,37948,2099227,2014-11-19,How to get started with your business idea,Education,6426,66,4,https://www.youtube.com/watch?v=SpmXmcmi1RM
55,SeedTime Money,2008-09-18,37948,2099227,2014-07-24,Bible Verses About Hope,Entertainment,7745,67,1,https://www.youtube.com/watch?v=1CEA3SXowQ0
56,SeedTime Money,2008-09-18,37948,2099227,2014-01-24,Bible Verses About Faith,Entertainment,16060,133,4,https://www.youtube.com/watch?v=4DiFEkUqFNM
57,SeedTime Money,2008-09-18,37948,2099227,2014-01-23,10 Bible Verses (Scriptures) About Love,Entertainment,91455,691,39,https://www.youtube.com/watch?v=hZpf_V1XIDk
58,SeedTime Money,2008-09-18,37948,2099227,2014-01-17,How to list an item on Ebay for beginners (listing on ebay),Howto & Style,113280,562,41,https://www.youtube.com/watch?v=0i7-vb4RrEg
59,SeedTime Money,2008-09-18,37948,2099227,2013-08-08,Locket App Review,Howto & Style,102203,158,20,https://www.youtube.com/watch?v=kWiSGk-uvYw
60,SeedTime Money,2008-09-18,37948,2099227,2012-05-30,How To Start A Blog (in 10 Minutes),Howto & Style,63233,115,4,https://www.youtube.com/watch?v=u4gunO49mlk
61,SeedTime Money,2008-09-18,37948,2099227,2011-11-08,Hostgator vs. Bluehost vs Dreamhost - I've Used Each Host & Here is My Review,Science & Technology,22040,68,16,https://www.youtube.com/watch?v=jIKOXMTpzPk
62,SeedTime Money,2008-09-18,37948,2099227,2011-06-21,5 Free Printable Budgeting Worksheets,Howto & Style,37715,42,9,https://www.youtube.com/watch?v=31REI9xA50Q
63,SeedTime Money,2008-09-18,37948,2099227,2010-08-26,10 Encouraging Bible Verses When You Need Encouragement,Entertainment,187194,846,28,https://www.youtube.com/watch?v=5i7pNzZJQ5M
64,SeedTime Money,2008-09-18,37948,2099227,2009-10-21,Ebates Cash-Back Program (how it works),Howto & Style,10676,15,0,https://www.youtube.com/watch?v=eQbDmhol_oM
65,SeedTime Money,2008-09-18,37948,2099227,2009-08-18,Virtual Envelope budgeting system - How to budget with ING Direct,Howto & Style,12824,13,1,https://www.youtube.com/watch?v=fmZBRiW4uOk
66,SeedTime Money,2008-09-18,37948,2099227,2009-08-18,How to sell on Ebay for beginners,Howto & Style,487217,1061,333,https://www.youtube.com/watch?v=kel5sMKyfxU
